{
  "meta": {
    "raw_message": "agentic step with standard parse",
    "parse": {
      "parser_name": "demo",
      "parser_version": "1.0.0",
      "pattern_id": "p1",
      "confidence": 0.95,
      "ok": true
    }
  },
  "step_kind": "step",
  "workflow_id": "wf-123",
  "step_id": "s-1",
  "tool_name": "search",
  "input_summary": "q=hello",
  "output_summary": "ok",
  "status": "success",
  "level": "info",
  "category": "agentic",
  "sub_category": "tool_call",
  "outcome": "success"
}
